State ,Clinic Name,District,Clinic Address,Lat/Long,Designation (SPC/DPC),"Clinic Status (Active/
Inactive)"
Kerala,EMS Hospital Perinthalmanna,Malappuram,"Clubfoot Clinic                                                                                                                       EMS Hospital, Perinthalmanna   Malappuram Dist-  679322",POINT (76.2554543395528 10.977586943485631),DPC,Inactive
Kerala,G.H. Thalasserry,Kannur,"Clubfoot Clinic                                                                                                                    General Hospital, Thalaserry Kannur Dist- 670101",,DPC,Inactive
Madhya Pradesh,"Gandhi Medical College, Bhopal",Bhopal,"Cure Clubfoot Clinic, Department of Orthopaedic, Gandhi Medical College, Bhopal - 462001",,SPC,Active
Madhya Pradesh,"Bundelkhand Medical College, Sagar",Sagar,"Cure Clubfoot Clinic, Deptt. of Orthopaedics, Bundelkhand Medical College Sagar - 470001",,Volunteer,Active
Madhya Pradesh,"Mahatma Gandhi Medical College, Indore",Indore,"Cure Clubfoot Clinic, Deptt. of Orthopaedics, M.Y. Hospital Indore, Indore - 452001",,Volunteer,Active
Madhya Pradesh,"Shyam Saha Medical College, Rewa",Rewa,"Cure Clubfoot Clinic, Deptt. of Orthopaedics, Shyam Shah Medical College Rewa - 486001",,DPC,Active
Madhya Pradesh,"Netaji Subhash Chandra Bose Medical College, Jabalpur",Jabalpur,"Cure Clubfoot Clinic, Deptt. of Orthopaedics, Netaji Subhash Chandra Bose Medical College Jabalpur - 482003",,DPC,Active
Madhya Pradesh,"Gajra Raja Medical College, Gwalior",Gwalior,"Cure Clubfoot Clinic, Deptt. of Orthopaedics, Gajra Raja Medical College Gwalior - 474009",,Volunteer,Active
Madhya Pradesh,District Hospital Gwalior,Gwalior,"Cure Clubfoot Clinic, Deptt. of Orthopaedics, District Hospital Gwalior - 474011",,Volunteer,Active
Madhya Pradesh,"Kushabhau Thakre District Hospital, Rewa",Rewa,"Cure Clubfoot Clinic, Deptt. of Orthopaedics, Kushabhau Thakre District Hospital Rewa - 486001",,DPC,InActive
Madhya Pradesh,District Hospital Sehore,Sehore,"Cure Clubfoot Clinic, Deptt. of Orthopaedics, District Hospital Sehore - 466001",,DPC,Active
Madhya Pradesh,District Hospital Hoshangabad,Hoshangabad,"Cure Clubfoot Clinic, Deptt. of Orthopaedics, District Hospital Hoshangabad, Narmadapuram - 466001",,Volunteer,Active
Madhya Pradesh,"AIIMS, Bhopal",Bhopal,"Cure Clubfoot Clinic, Department of Orthopaedic, AIIMS Bhopal, Bhopal - 462026",,SPC,Active
Madhya Pradesh,District Hospital Mandla,Mandla,"Cure Clubfoot Clinic, Deptt. of Orthopaedics, District Hospital Mandla - 481661",,DPC,Active
Madhya Pradesh,"Victoria District Hospital, Jabalpur",Jabalpur,"Cure Clubfoot Clinic, Deptt. of Orthopaedics, Govt. Seth Govind Das (Victoria) District Hospital Jabalpur - 482002",,DPC,Active
Madhya Pradesh,District Hospital Betul,Betul,"Cure Clubfoot Clinic, Deptt. of Orthopaedics, District Hospital Betul - 460001",,Volunteer,Active
Madhya Pradesh,District Hospital Seoni,Seoni,"Cure Clubfoot Clinic, Deptt. of Orthopaedics, District Hospital Seoni - 480661",,DPC,inActive
Madhya Pradesh,District Hospital Shivpuri,Shivpuri,"Cure Clubfoot Clinic, Deptt. of Orthopaedics, District Hospital Shivpuri - 473551",,Volunteer,Active
Madhya Pradesh,"District Hospital, Balaghat",Balaghat,"Cure Clubfoot Clinic, Deptt. of Orthopaedics, District Govt Hospital Balaghat - 481001",,Volunteer,Active
Madhya Pradesh,"District Hosital, Vidisha",Vidisha,"Cure Clubfoot Clinic, Deptt. of Orthopaedics, District Civil Hospital Vidisha - 464001",,DPC,Active
Madhya Pradesh,"District Hospital, Chattarpur",Chattarpur,"Cure Clubfoot Clinic, Deptt. of Orthopaedics, District Civil Hospital Chhatarpur - 471001",,Volunteer,Active
Madhya Pradesh,"District Hospital, Ratlam",Ratlam,"Cure Clubfoot Clinic, Deptt. of Orthopaedics, District Civil Hospital Ratlam - 457001",,Volunteer,Active
Madhya Pradesh,"Gandhi Medical College, Bhopal, Fri",Bhopal,"Cure Clubfoot Clinic, Department of Orthopaedic, Gandhi Medical College, Bhopal - 462001",,DPC,Active
Madhya Pradesh,"Netaji Subhash Chandra Bose Medical College, Jabalpur, Wed",Jabalpur,"Cure Clubfoot Clinic, Deptt. of Orthopaedics, Netaji Subhash Chandra Bose Medical College Jabalpur - 482003",,DPC,Active
Madhya Pradesh,"Shyam Saha Medical College, Rewa, Wed",Rewa,"Cure Clubfoot Clinic, Deptt. of Orthopaedics, Shyam Shah Medical College Rewa - 486001",,DPC,Active
Madhya Pradesh,"Mahatma Gandhi Medical College, Indore, Sat",Indore,"Cure Clubfoot Clinic, Deptt. of Orthopaedics, M.Y. Hospital Indore - 452001",,Volunteer,Active
Madhya Pradesh,District hospital Shahdol,Shahdol,"Cure Clubfoot Clinic, Deptt. of Orthopaedics, District Hospital Shahdol - 484001",,Volunteer,Active
Madhya Pradesh,Birsa Munda Medical College Shahdol,Shahdol,"Cure Clubfoot Clinic, Department of Orthopaedic, Govt. Birsa Munda Medical College, Shahdol - 484001",,Volunteer,Active
Maharashtra,B. J. Wadia Hospital,Mumbai,,,,Inactive
Maharashtra,L. T. Hospital Sion,Mumbai,"L.T. Hospital Sion,New Building ,Near Gate no-7,OPD no-14",,SPC,Active
Maharashtra,"Bharati hospital, Pune",Pune,"Bharati Hospital and Research Center Pune ,Ortho OPD No-1",,ASS SPC,Active
Maharashtra,"SKNMC Hopsital, pune",Pune,"Smt. Kashibai Navale Medical College and General Hospital(Ortho OPD),OPD No-27",,ASS SPC,Active
Maharashtra,"IGM, Bhiwandi, Thane",Thane,"IGM Bhiwandi,Ortho OPD No-11",,ASS SPC,Active
Maharashtra,"OH, Parbhani",Parbhani,"Orthopedic Hospital Parbhani,OPD NO-8",,DPC,Active
Maharashtra,"Aundh Civil Hospital, Pune",Pune,"District Hospital Aundh,Ortho Opd no-6",,ASS SPC,Active
Maharashtra,"Civil hospital, Satara",Satara,,,DPC,Inactive
Maharashtra,"Civil Hopspital, Osmanabad",Osmanabad,"Osmanabad Civil Hospital,DEIC",,DPC,Active
Maharashtra,"Civil Hospital, Bhandara",Bhandara,"Civil Hospital Bhandara,DEIC",,DPC,Active
Maharashtra,"Civil Hospital, Nasik",Nasik,"Civil Hospital NasikOPD No-2,Operation Theater",,DPC,Active
Maharashtra,B. J. Wadia Hospital (TH),Mumbai,,,,Inactive
Maharashtra,GMC Nanded (Friday),Nanded,"GMC Hospital Vishnu puri,OPD NO-115 &116",,DPC,Active
Maharashtra,"LMH, Nagpur",Nagpur,"Lata Mangeshkar Hospital,Hingna,OPD No-8",,DPC,Active
Maharashtra,GMC Nanded (Wednesday),Nanded,"GMC Hospital Vishnu puri,OPD NO-115 &116",,DPC,Active
Maharashtra,GMC Pune(sasson),Pune,"Sassoon Hospital(Ortho Department ),OPD No-35",,ASS SPC,Active
Maharashtra,GMC Kolhapur,Kolhapur,"CPR Hospital Kolhapur,Orthopedic OPD No-104",,DPC,Active
Maharashtra,GMC Dhule,Dhule,"Shree Bhausaheb Hire Govt Medical College, Orthopadic OPD No-32",,DPC,Active
Maharashtra,JJ Hospital,Mumbai,"J. J. Hospital Mumbai,OPD No-3,Near Gate no -6",,SPC,Active
Maharashtra,"Civil Hospital, Sangli",Sangli,"P.V.P Civil Hospital Sangli,OPD No-20,",,DPC,Active
Maharashtra,GMC Miraj,Sangli,"Goverment Medical college and Hospital ,OPD No-14,",,DPC,Active
Maharashtra,DEIC Thane,Thane,"Thane Civil Hospital,Ortho OPD No-9",,DPC,Active
Maharashtra,GMC Gondia,Gondia,GMC Gondia OPD No-107,,DPC,Active
Maharashtra,GMC Solapur,Solapur,GMC Solapur OPD No-29,,DPC,Active
Maharashtra,GMC Yavatmal,Yavatmal,"GMC Yavatmal, OPD No-44",,DPC,Active
Maharashtra,"Civil Hospital, Wardha",Wardha,"Civil Hospital Wardha, OPD No-18",,DPC,Active
Maharashtra,"Civil Hospital, Amravati",Amravati,"Civil Hospital Amravati, OPD No-10",,DPC,Active
Maharashtra,"Civil Hospital, Sindhudurg",Sindhudurg,"Civil Hospital Sindhudurg, Orhto OPD",,DPC,Active
Maharashtra,GMC Chandrapur,Chandrapur,"GMC Chandrapur,Ortho OPD",,DPC,Active
Maharashtra,GMC Latur,Latur,"GMC Latur,OPD No--7A",,DPC,Active
Maharashtra,"Civil Hospital, Washim",Washim,"Civil Hospital Washim,Ortho OPD No-19",,DPC,Active
Maharashtra,"Civil Hospital, Jalna",Jalna,Civil Hospital Jalna DEIC,,DPC,Active
Maharashtra,GMC Akola,Akola,"Goverment Medical College and Hospital,OPD NO-114",,DPC,Active
Maharashtra,VVCMC Nallasopara,Palghar,,,ASS SPC,Inactive
Maharashtra,SGGSM Nanded,Nanded,"Gurugovind  Singh Civil Hospital,Orthopedic OPD-15",,DPC,Active
Maharashtra,NH SRCC,Mumbai,"NH SRCC Hajiali,Cluster No-2",,ASS SPC,Active
Maharashtra,"Shatabdi Hospital, Govandi",Mumbai,Shatabdi Hospital Govandi ortho opd no-20Govandi east,,DPC,Active
Maharashtra,PDMC amravati,Amravati,PDMMC Hospital Ortho OPD No-5,,DPC,Active
Maharashtra,"DM Petit Hospital, Vasai",Palghar,"VVCMC D.M Petit Hospital Orthopadic OPD,Vasai West..",,ASS SPC,Active
Maharashtra,"Civil Hospital, Ratnagiri",Ratnagiri,"Civil Hospital Ratnagiri,Orthopadic OPD",,DPC,Active
Maharashtra,"Civil Hospital, Ahmednagar",Ahmadnagar,Civil Hospital Ahmadnagar Orhtopadic OPD No-6,,DPC,Active
Maharashtra,"Civil Hospital, Hingoli",Hingoli,Civil Hospital Hingoli Orthopedic OPD-3,,DPC,Active
Maharashtra,GMC Jalgaon,Jalgaon,"Goverment Medical College,Orthopadic OPD No-115",,DPC,Active
Maharashtra,GMC Sambhajinagar,Sambhaji Nagar,"Government Medical College, Chhatrapati Sambhajinagar OPD No-117",,DPC,Active
Maharashtra,"Civil Hospital, Raigad",Raigad,"Raigad Civil Hospital Alibag,DEIC",,DPC,Active
Maharashtra,"Sub-District Hospital, Panvel",Raigad,"Sub District Hospital, Panvel,Ortho OPD - 13",,DPC,Active
Maharashtra,"YCM Hospital, Pune",Pune,"YCM Hospital Pimpri Chinchwad, Ortho OPD No-11",,ASS SPC,Active
Maharashtra,"Civil Hospital, Chikalthana",Sambhaji Nagar,District CivilHospital Chikalthana OPD no. 4 ,,DPC,Active
Maharashtra,"Civil Hospital, Beed",Beed,"Civil Hospital Beed,Orthopadic OPD ",,DPC,Active
Maharashtra,"GMC Ambejogai, Beed",Beed,GMC Ambejogai Orthopadic OPD ,,DPC,Active
Maharashtra,"Civil Hospital, Buldhana",Buldhana,"District Civil Hospital Buldhana,  Orthopadic OPD",,DPC,Active
Maharashtra,GMC Solapur Friday,Solapur,GMC Solapur OPD No-29,,DPC,Active
Maharashtra,"Civil Hospital, Nasik Thursday",Nasil,"Civil Hospital NasikOPD No-2,Operation Theater",,DPC,Active
Maharashtra,"GMC Ambejogai, Beed, TH",Beed,GMC Ambejogai Orthopadic OPD Thursday,,DPC,Active
Manipur,"Jawaharlal Nehru Institute of Medical Sciences, Imphal",Imphal east,"Jnims orthopedic department,Porompat, Imphal east, Manipur",,SPC,Active
Meghalaya,"Civil hospital - Shillong,",east khasi hills district,"civil hospital, shillong",,Spc,active
Nagaland,Naga hospital Authority Kohima,Kohima,,,SPC,Active
Odisha,"SCBMCH, CUTTACK",Cuttack,"Cure Clubfoot,Orthopedic Department,SCB MCH,Cuttack",,DPC,Active
Odisha,"VSS, BURLA",Sambalpur,,,Paid Volunteer,Active
Odisha,"MKCGH, BEHRAMPUR",Berhampur,,,DPC,Active
Odisha,"DHH, KORAPUT",Koraput,,,DPC,Active
Odisha,"RGH, ROURKELA",Sundergarh,,,DPC,Active
Odisha,"SVNIRTAR, Cuttack",Cuttack,,,DPC,Active
Odisha,"SISHU BHAWAN, Cuttack",Cuttack,"DEIC, Sishu Bhaban, Cuttack",,SPC,Inactive
Odisha,CAPITAL HOSPITAL BHUBANESWAR,Khorda,"DEIC, Capital Hospital ",,Paid Volunteer,Active 
Odisha,"SCBMCH, CUTTACK, FRIDAY",Cuttack,"Cure Clubfoot,Orthopedic Department,SCB MCH,Cuttack",,DPC,Active
Odisha,"SISHU BHAWAN, Cuttack, THURSDAY",Cuttack,"DEIC, Sishu Bhaban, Cuttack",,SPC,Active
Odisha,"MKCGH, BEHRAMPUR, THURSDAY",Berhampur,,,DPC,Active
Odisha,"VSS, BURLA, FRIDAY",Sambalpur,,,Paid Volunteer,Active
Odisha,"DHH KORAPUT, FRIDAY",Koraput ,,,DPC,Active
Odisha,"SVNIRTAR, Cuttack, TUESDAY",Cuttack,,,DPC,Active
Odisha,"SVNIRTAR, Cuttack, WEDNESDAY",Cuttack,,,DPC,Active
Odisha,"Pandit Raghunath Murmu MCH, Baripada",Baripada,,,Volunteer,Active
Odisha,"Fakir Mohan MCH, Balesore",Balesore,,,Volunteer,Active
Odisha,"District Headquarter Hospital, Angul",Angul,,,Volunteer,Active
Rajasthan,Sawai Man Singh Medical College (SMS) in Jaipur,JAIPUR,"SMS HOSPITAL, JAIPUR, RAJASTHAN",,DPC,ACTIVE
Rajasthan,Jawarharlal Nehru (JLN) Medical College in Ajmer,AJMER,"JLN HOSPITAL, AJMER",,DPC,ACTIVE
Rajasthan,Sardar Patel Medical College in Bikaner,BIKANER,"SARDAR PATEL MEDICAL COLLEGE, BIKANER",,DPC,ACTIVE
Rajasthan,Government Medical College in Kota,KOTA,"MAHARAO BHIM SINGH HOSPITAL, KOTA",,DPC,ACTIVE
Rajasthan,Sampurnanand Medical College (SNMC) in Jodhpur,JODHPUR,SN MEDICALCOLLEGE. JODHPUR,,ASPC,ACTIVE
Rajasthan,"Sawai Man Singh Medical College (SMS) in Jaipur, Monday",JAIPUR,"SMS HOSPITAL, JAIPUR, RAJASTHAN",,DPC,ACTIVE
Rajasthan,"Sawai Man Singh Medical College (SMS) in Jaipur, Tuesday",JAIPUR,"SMS HOSPITAL, JAIPUR, RAJASTHAN",,DPC,ACTIVE
Rajasthan,"Sawai Man Singh Medical College (SMS) in Jaipur, Thursday",JAIPUR,"SMS HOSPITAL, JAIPUR, RAJASTHAN",,DPC,ACTIVE
Rajasthan,"Sawai Man Singh Medical College (SMS) in Jaipur, Saturday",JAIPUR,"SMS HOSPITAL, JAIPUR, RAJASTHAN",,DPC,ACTIVE
Rajasthan,"All India Institute of Medical Sciences, Jodhpur",JODHPUR,"All India Institute of Medical Sciences, Jodhpur",,ASPC,ACTIVE
Sikkim,"Sir Thodup Namgyal Hospital, Gangtok",Gangtok,"STNM,Sochakgang, Gangtok",,DPC,Active
Tamilnadu,Institute of child health and hospital for children,Chennai,"Cure India, Department of Orthopedics,  Institute of Child Health and Hospital for children, Egmore, Chennai - 600008",,SPC & DPC,Active
Tamilnadu,Coimbatore Government Medical college Hospital,Coimbatore,"Department of Orthopedics,  1619 A, Trichy Rd, Gopalapuram, Coimbatore, Tamil Nadu 641018",,DPC,Active
Tamilnadu,"Government Rajaji Medical college Hospital, Madurai",Madurai,"Department of Orthopedics,  GH Post Office, Poonamallee High Road, 3, Grand Southern Trunk Rd, near Park Town, Near Chennai Central, Park Town, Chennai, Tamil Nadu 600003",,DPC,Active
Tamilnadu,Thanjavur Government Medical college Hospital,Thanjvaur,"Department of Orthopedics,  Medical College Rd, Thanjavur, Tamil Nadu 613004",,DPC,Active
Tamilnadu,Vellore Government Medical college Hospital,Vellore,"Department of Orthopedics, R4VP+QQP, Arani Road, Opposite Staff Quarters, Adukkamparai, Vellore, Tamil Nadu 632011",,DPC,Active
Tamilnadu,Dharmapuri Government Medical college Hospital,Dharmapuri,"Department of Orthopedics, 45F4+4V9, Indhira Nagar, Dharmapuri, Tamil Nadu 636701",,DPC,Active
Tamilnadu,Tirunelveli Government Medical college Hospital,Tirunelveli,"Department of Orthopedics, 3, High Ground Rd, Palayamkottai, Tirunelveli, Tamil Nadu 627011",,DPC,Active
Tamilnadu,Cuddalore Government Medical college Hospital,Cuddalore,"Department of Orthopedics, Cuddlore GH
Hospital road,
Manjakuppam.
Cuddalore.TN -607001
",,DPC,Active
Tamilnadu,Puducherry Medical college Hospital,Puducherry,"Department of Orthopedics, Victor Simonel St, White Town, Puducherry, 605001",,DPC,Active
Tamilnadu,Villupuram Government Medical college Hospital,Villupuram," Department of Orthopedics, XGV8+6XV, Medical College Rd, Mundiyampakkam, Tamil Nadu 605601",,DPC,Active
Telangana,"Gandhi Medical College, Hyderabad",Hyderabad,"Gandhi Hospital,Room no:38,OPD Block  Orthopeadics,Musheerabad,Secunderabad, Telangana-500003",,ASPC,Active
Telangana,"Osmania Medical College, Hyderabad",Hyderabad,"Osmania General Hospital,Ortho Department,Room No124,Afzal gung",,ASPC,Active
Telangana,GGH - Nizamabad,Nizamabad,"Cure India,Government General Hospital,Nizamabad,OPD Block,Room No:370&371",,DPC,Active
Telangana,MGMH - KMC Warangal,Warangal,"Cure India,Mahathma gandhi Memorial Hospital-MGMH,ODP Block,Orthpeadics,Room No12&13,Warangal-506001",,DPC,Active
Telangana,RIMS - Adilabad,Adilabad,"Cure I ndia,Rajeev Gandhi Institute of Medical Science-RIMS,OPD Block,Orthopeadics,Room No:12&13,Adilabad-504001",,DPC,Active
Telangana,MGMH - KMC Warangal Saturday,Warangal,"Cure India,Mahathma Gandhi Memorial Hospital-MGMH,OPD Block,Orthopeadics,Room no:12&13,Warangal-506001",,Dpc,Active
Tripura,"Govt. Medical College and GBPH, Agartala",West Tripura,"AGMC&GBPH, orthopedic ward, Kunjaban, pin-799006",,SPC,Active
Uttar Pradesh,"MLBMC, Jhansi",Jhansi,"MLBMC, Jhansi",,DPC,Active
Uttar Pradesh,"JLNMC, Aligarh",Aligarh,"Jawahar Lal Nehru Medical College, Aligarh",,DPC,Active
Uttar Pradesh,"SNMC, Agra, Thursday",Agra,"Rajamandi, Sarojini Naydu Medical College, Agra",,DPC,Active
Uttar Pradesh,"KGMU, Lucknow Monday",Lucknow,"4th floor, New OPD, Shahmina road,  KGMU",,ASPC,Active
Uttar Pradesh,"GSVM, Kanpur",Kanpur,"GSVM, Kanpur",,DPC,Active
Uttar Pradesh,"BRD, Gorakhpur",Gorakhpur,"BRD Medical College, Gorakhpur",,DPC,Active
Uttar Pradesh,"MLNMC, Allahabad",Allahabad,Motilal Nehru Medical College,,DPC,Inactive
Uttar Pradesh,"LLRM, Meerut",Meerut,"LLRM, Meerut",,DPC,Active
Uttar Pradesh,"BHU, Varanasi, Tuesday",Varanasi,"BHU, Varanasi",,DPC,Active
Uttar Pradesh,BHU Varanasi Saturday,Varanasi,"BHU, Varanasi",,DPC,Active
Uttar Pradesh,"UPRIMS, Saifai",Etawah,"Uttar Pradesh University of Medical Science, Saifai Etawah",,DPC,Active
Uttar Pradesh,"KGMU, Lucknow Wednesday",Lucknow,"4th Floor, Shahmina road, new OPD,KGMU",,ASPC,Active
Uttar Pradesh,District joint hospital Sobhadra ,Sobhadra,"District Joint Hospital, Sonbhadra",,DPC,Inactive
Uttar Pradesh,AIIMS Hospital Raebarily ,Raebareli,"AIIMS, Dariyapur, Munshiganj, Raebareli",,DPC,Active
Uttar Pradesh,MRA MC Ambedkar Nagar,Ambedkar Nagar,MRA MC Ambedkar Nagar,,DPC,Inactive
Uttar Pradesh,RDAS MC Ayodhya,Ayodhya,"Rajashree dashrath Autonomous State medical College, Darshan Nagar, Ayodhya",,DPC,Active
Uttar Pradesh,"District Hospital, Jaunpur",Jaunpur,NIL,,DPC,Inactive
Uttar Pradesh,District Hospital Mirzapur,Mirzapur,"Maa  Vindhyavasinini Swashashi Medical College, Mirzapur",,DPC,Active
Uttar Pradesh,Maharshi Vashishtha  M.C Basti,Basti,"Maharishi Vashishth Medical College, Basti",,DPC,Active
Uttar Pradesh,Govt. MC Chakrapanpur Azamgarh,Azamgarh,"Govt Medical College, Chakrapanpur, Azamgarh",,DPC,Active
Uttar Pradesh,District Hospital Ballia,Balia,"District Hospital, Balia",,DPC,Inactive
Uttar Pradesh,Medical College Banda,Banda,"Rani Durgavati Medical College, Banda",,DPC,Active
Uttar Pradesh,"SNMC, Agra, Monday",Agra,"Rajmandi, Sarojini Naydu, Medical College, Agra",,DPC,Active
Uttar Pradesh,BHU Varanasi Monday ,Varanasi,"BHU, Varanasi",,DPC,Active
Uttar Pradesh,BHU Varanasi Wednesday ,Varanasi,"BHU, Varanasi",,DPC,Active
Uttarakhand,"STMC, Haldwani Friday",Haldwani,Dr. Susheela Tiwari Government Hospital,,,Active
Uttarakhand,"DEIC, Base Hospital, Almora",Almora,Goverdhan Tiwari Government Base Hospital,,Dpc,Active
Uttarakhand,"DEIC, Base Hospital, Haldwani",Haldwani,Soban Singh Jeena Base Hospital Haldwani,,Dpc,Active
Uttarakhand,"Doon Hospital, Dehradun",Dehradun,Government Doon Hospital & College,,Spc,Active
Uttarakhand,AIIMS Rishikesh,Dehradun,All India Institute of Medical Sciences,,SPC,Active
Uttarakhand,Ramakrishna Mission Hospital (Friday),Haridwar,,,Dpc,Active
West Bengal,Nil Ratan Sircar Medical College & Hospital,Kolkata,,,SPC,Active
West Bengal,"IPGMER & SSKM Medical College & Hospital, THU",Kolkata,,,DPC,Active
West Bengal,"Calcutta Medical College & Hospital, Friday",Kolkata,,,DPC,Active
West Bengal,"North Bengal Medical College & Hospital, THU",Siliguri,,,DPC,Active
West Bengal,R.G Kar Medical College & Hospital,Kolkata,,,DPC,Active
West Bengal,"Calcutta National Medical College & Hospital, Kolkata, TUE",Kolkata,,,DPC,Active
West Bengal,"Burdwan Medical College & Hospital (Burdwan District), FRI",Burdwan,,,DPC,Active
West Bengal,"Midnapore Medical College & Hospital, MON",Midnapur,,,DPC,Active
West Bengal,"Bankura Sammilani Medical College & Hospital, Mon",Bankura,,,DPC,Active
West Bengal,Malda Medical College and Hospital (Malda District),Malda,,,DPC,Active
West Bengal,"College Of Medicine & Sagar Dutta Hospital, Kolkata ",North 24pgs,,,DPC,Active
West Bengal,North Bengal Medical College & Hospital (Wed),Siliguri,,,DPC,Active
West Bengal,Burdwan Medical College & Hospital (Burdwan District) (TH),Burdwan,,,DPC,Active
West Bengal,Bankura Sammilani Medical College & Hospital (Sat),Bankura,,,DPC,Active
West Bengal,Chanchal Super Speciality Hospital,Malda,NA,,NA,Inactive
West Bengal,CALCUTTA NATIONAL MEDICAL COLLEGE (MONDAY),Kolkata,NA,,NA,Inactive
West Bengal,CALCUTTA NATIONAL MEDICAL COLLEGE (Saturday)  ,Kolkata,,,DPC,Active
West Bengal,North Bengal Medical College & Hospital (Mon),Siliguri,NA,,NA,Inactive
West Bengal,North Bengal Medical College & Hospital (Sat),Siliguri,NA,,NA,Inactive
West Bengal,"Maharaja Jitendra Narayan MCH, Cooch Behar",Cooch Behar,,,Volunteer,Active
West Bengal,"Murshidabad MCH, WED",Murshidaabad,,,DPC,Active
West Bengal,"Diamond Harbour MCH, WED",South 24pgs,,,DPC,Active
West Bengal,"Deben Mahato Govt. MCH, Purulia, THU",Purulia,,,DPC,Active
West Bengal,Rampurhat MCH,Birbhum,,,DPC,Active
West Bengal,College Of Medicine & Jawarharlal Nehru Memorial Hosp. Kalyani,North 24pgs,,,DPC,Active
West Bengal,"B C Roy Polio Hospital, Wednesday",Kolkata,,,DPC,Inactive
West Bengal,"Diamond Harbour MCH, Saturday",South 24pgs,,,DPC,Active
West Bengal,"B C Roy Polio Hospital, Friday",Kolkata,,,DPC,Inactive
West Bengal,"IPGMER & SSKM Medical College & Hospital (Kolkata), TUE",Kolkata,,,DPC,Active
West Bengal,"Midnapore Medical College & Hospital, Wednesday",Midnapur,,,DPC,Active
West Bengal,Murshidabad MCH Thursday,Murshidabad,POINT (86.4057744165993 23.450310880110916),,DPC,Active
West Bengal,Asansol  DH THU,Paschim Burdwan,,,Volunteer,Active
West Bengal,"Calcutta Medical College & Hospital, Thursday",Kolkata,,,DPC,Active
West Bengal,"Deben Mahato Govt. MCH, Purulia.Tuesday",Purulia,,,DPC,Active
